R_ID,scientific_name,reference,taxonomy,bibliographic_citation,name_according_to,taxonomic_status,nomenclatural_status,class,order,family,genus,first_observation_text,distribution_belgium_text,native_range_text,introduction_pathway_text,degree_of_establishment_text,first_observation,last_observation,occurrence_status,source_distribution,native_range,introduction_pathway,degree_of_establishment,source_description
R07084,"Hawaiia minuscula (Binney, 1841)",,Well-defined species.,,,,,"Gastropoda Cuvier, 1798","Stylommatophora A. Schmidt, 1858","Pristilomatidae T. Cockerell, 1891","Hawaiia Gude, 1911",This species was for the first time reported in Belgium from the “Victoriakas” (greenhouse) of the botanical garden at the University of Gent in 2003 (Keppens & Dhondt 2007). No other,Only known from the first record at the botanical garden of the University of Gent. No records in Waarnemingen.be (consulted on 4 February 2019). Probably more widespread in other botanical gardens and greenhouses.,"Southeastern and central Europe, including the Balkan.",Unclear (if it was ever introduced at all).,"A single, or a few, accidental introductions; category C0.",2003,,present,Keppens & Dhondt 2007,"Southeastern Europe, Central Europe, Balkan.",,C0,
R07551,"Hygromia cinctella (Draparnaud, 1801)",,Well-defined species.,,,,,"Gastropoda Cuvier, 1799","Stylommatophora A. Schmidt, 1859","Hygromiidae Tryon, 1866","Hygromia Risso, 1826","The species was for the first time collected in Belgium in May 1994 in Honnelles (Bois d'Angre; province of Hainaut). Subsequently it was not reported until it was found again in November 2006 at Labussière (Carrière des Carmes; province of Hainaut). Afterwards, between 2007 and 2011 the species was found at four more localities. Yet, since 2012 the species seems to expand rapidly in Belgium and in 2014 it was already known from 45 localities in 37 UTM 5 km squares, mainly in Brussels and Flanders. Between 2013 and 2017 another 23 new localities were reported in Wallonia.","Currently (March 2018) the species has been reported from well over 70 localities, all over the country. Information based on a compilation of the data presented by Van den Neucker & Scheers (2014), Delcourt & Vilvens (2017) and Waarnemingen.be.",North America.,Probably introduced unintentionally with foreign plant materials.,The extent by which the species is established in Belgian greenhouses and nurseries needs to be investigated. Category B2.,1994,,present,"Van den Neucker & Scheers 2014, Delcourt & Vilvens 2017",North America.,stowaway,B2,
R05616,"Massylaea vermiculata (O.F. Müller, 1774)",,"Well-defined species. Until recently the species was known as Eobania vermiculata, but Bouaziz-Yahiatene et al. (2017) have shown that Eobania P. Hesse, 1913 is a junior synonym of Massylaea Möllendorff, 1898.",,Bouaziz-Yahiatene et al. (2017),,,"Gastropoda Cuvier, 1800","Stylommatophora A. Schmidt, 1860","Helicidae Rafinesque, 1815","Massylaea Möllendorff, 1898","The first free-living population in Belgium was reported from the harbour of Zeebrugge (51°20'16""N; 3°10'47""E), where 5 empty shells were found on 17 September 2014 and 20 living specimens on 9 November 2014.",Only known from the first record at Zeebrugge. Waarnemingen.be (consulted on 4 February 2019) reports several new observations of live animals from the same locality at Zeebrugge between 2014 and 2018.,"Ill-defined, but supposed to include southeastern France, Italy, Slovenia and northwestern Croatia.","The species may be unintentionally introduced by man via transport of plants (gardens) (passive dispersal) and construction materials. Yet, active (natural) dispersal along rivers has also been suggested.",Fully invasive species; category E.,2014,2018,present,,"southeastern France, Italy, Slovenia, northwestern Croatia.","stowaway, dispersal",E,
R10800,"Paralaoma servilis (Shuttleworth, 1852)",,Well-defined species.,,,,,"Gastropoda Cuvier, 1801","Stylommatophora A. Schmidt, 1861","Punctidae Morse, 1864","Paralaoma Iredale, 1913","The species was for the first time collected alive in Belgium on October 19th 2014 in Turnhout (10 specimens on an iron fence between a lawn and a road near the city centre). Subsequently, 12 specimens were collected on November 10th in the “Warandepark” in the centre of Brussels. Waarnemingen.be mentions that one dead shell was collected on March 30th 2012.","Since the two records in 2014, the species has been repeatedly collected alive at several localities in Flanders and Wallonia (Waarnemingen.be).","Circum-Mediterranean, though not indiginous in the southeastern Mediterranean region, where it has been introduced.","Most probably accidentally introduced with container traffic. Yet, the species has occasionally been introduced in Belgium for rearing purposes (e.g. Adrians 2000; Anonymous [citing Adrians] 2001; Mienis 2011).","Potentially invasive, but the population at Zeebrugge was intentionally eradicated, though apparently not completely as the species was recently re-observed in 2017-2018. Category C3.",2014,,present,,Circum-Mediterranean,stowaway,C3,"Adriaens 2000, Adriaens 2001, Mienis 2011"
R14716,"Subulina striatella (Rang, 1831)",,Well-defined species.,,,,,"Gastropoda Cuvier, 1802","Stylommatophora A. Schmidt, 1862","Subulinidae P. Fischer & Crosse, 1877","Subulina Beck, 1837",The species was for the first time reported alive in Belgium on 26 November 2013 in the Mabundu greenhouse of the National Botanical Garden at Meise.,"Since the first record, the species has been observed once on 12 January 2018 in the city centre of Gent at the Ledeganck Campus of the University of Gent (Waarnemingen.be accessed on 5 August 2018).","The species is often referred to as cosmopolitan, but its native range is most probably New Zealand and Australia, from where the species has been introduced elsewhere in the world.",The species may be unintentionally introduced by man via transport of plants (gardens) (passive dispersal).,Fully invasive species; category E.,2013,2018,present,,"New Zealand, Australia",stowaway,E,
R14897,"Tandonia budapestensis (Hazay, 1880)",,Well-defined species.,,,,,"Gastropoda Cuvier, 1803","Stylommatophora A. Schmidt, 1863","Milacidae Ellis, 1926","Tandonia Lessona & Pollonera, 1882","The species was first recorded in Belgium in 1941-1944 in gardens in and around Brussels by Adam (1944) under the name Milax sowerbyi (Adam 1960a, b). Later the occurrence and spread of T. budapestensis in Belgium was confirmed by Moens (1959, 1962). Records in Belgium from before 1941 are highly doubtful.",All over Belgium (De Wilde et al. 1986).,"Tropical western Africa.
",Accidentally introduced with foreign plant materials.,It remains to be investigated to what extent the species is established as greenhouse inhabitant in Belgium. Category B2.,1941,,present,"Adam 1944, Adam 1960a, Adam 1960b, Moens 1959, Moens 1962, De Wilde et al. 1986","Tropical western Africa.
",stowaway,B2,
R14899,"Tandonia sowerbyi (A. Férussac, 1823)",,Well-defined species. In Belgium it has often been confused with Tandonia budapestensis.,,,,,"Gastropoda Cuvier, 1804","Stylommatophora A. Schmidt, 1864","Milacidae Ellis, 1927","Tandonia Lessona & Pollonera, 1883","There are no verifiable records from Belgium, but according to Van Goethem (1988) the species was repeatedly observed in gardens by R. Moens (1983; Station Entomologique de l'état, Gembloux, Belgium). Unfortunately this material was not kept, so it cannot be checked. Nevertheless, Moens (1981) included the species in his identification key for Belgian terrestrial slugs. Previously, Schouten (1949) did mention that the species occurs in Belgium, yet he neither provided references, nor specimens to underpin his claim. There are a few records on Waarnemingen.be, but only a record of one slug from Altenbroek (2014; Voeren, Province of Limburg) seems to be documented and reliable. Two subsequent records from the same locality in 2016 are supposed to be reliable too. If these records are confirmed, then the 2014 specimen may be the first reliable record of the species in Belgium.",Unknown,"Carpathians and southern Alps (Frömming 1955), southeastern Alps and northern Balkan (Fechter & Falkner 1990).",Probably introduced unintentionally with foreign plant material.,Fully invasive species; category E.,1983,,doubtful,"Van Goethem 1988, Moens 1981, Schouten 1949, Altenbroek 2014","Carpathians, southern Alps, southeastern Alps, northern Balkan",stowaway,E,"Frömming 1955, Fechter & Falkner 1990"
R14996,"Testacella haliotidea Draparnaud, 1801",,Well-defined species.,,,,,"Gastropoda Cuvier, 1805","Stylommatophora A. Schmidt, 1865","Testacellidae Gray, 1840","Testacella Lamarck, 1801","Adam (1947) mentiond that (in the 1860-70ies) J. Colbeau looked for this species in Belgium, but never found it. Yet, Colbeau did refer to J. Deby, who claimed that the species lived in some gardens at Fonds-de-Leffe, near Dinant (Anonymous 1864; Colbeau 1865). Still earlier, Colbeau (1859) stated that “Some persons believe that the species is acclimatized in some greenhouses and orangeries in our country”. Much later, Van Goethem (1987, 1988) reported a specimen that was collected in 1983 around Oostende and that was sent to him for verification in 1985 by K. Verschoore. Possibly a juvenile specimen was collected in 1977 in a winter garden at Temse. The specimen is deposited in the collections of the RBINS (I.G. 25.548) (Van Goethem 1988).",No other records are known from Belgium. Nevertheless Rinaldi (2003) claims that the species is certainly present in Belgium.,"Unclear, maybe Balkan to Greece.",Unknown,Unclear; maybe Category B3.,1860,,present,"Adam 1947, Colbeau 1865, Colbeau 1859, Van Goethem 1987, Van Goethem 1988, Van Goethem 1988, Rinaldi 2003",Unclear,,B3,
R15086,"Theba pisana (O.F. Müller, 1774)",,Well-defined species.,,,,,"Gastropoda Cuvier, 1805","Stylommatophora A. Schmidt, 1865","Helicidae Rafinesque, 1815","Theba Risso, 1826","The species was recorded for the first time in Belgium by Hostie (1935), who in September 1934 collected nearly 300 live specimens in coastal dunes at Mariakerke near Oostende (Adam & Leloup 1937). Subsequently, the spread of the species was documented by several authors, e.g. Adam (1947a, b), Verhaeghe (1947), Anteunis (1956), and Deblock & Hoestlandt (1967).","Currently the species is common in suitable habitats all over the Belgian coastal dune area (De Smet & Van Rompu 1989; Devriese et al. 2004; Severijns et al. 2013, 2015). There are also many records from this region in Waarnemingen.be, as well as some occasional records from elsewhere in the country (Zwijndrecht, Zelzate, Ledeberg, Opglabbeek). The record from the Antwerpen harbour mentioned by De Wilde et al. (1986) and cited by Devriese et al. (2004) is a misidentification and refers to the Xerosecta cespitum (Draparnaud, 1801) population reported by Marquet (1985).","S Europe and W Mediterranean. According to Van Goethem (1987, 1988) and Rinaldi (2003) the species is probably authochtonous in Belgium. Yet, despite dedicated searches by J. Colbeau in the 19th century, W. Adam about halfway the 20th century (Adam 1947) and still more recent surveys (e.g. Marquet 1982) there is no convincing evidence of this.",Unintentionally introduced with foreign plant materials (Van Goethem 1988).,A few accidental introductions; category C0.,1934,,present,"Hostie 1935, Adam & Leloup 1937, Adam 1947a, Adam 1947b, Verhaeghe 1947, Aneunis 1956, Deblock & Hoestlandt 1967, De Smet & Van Rompu, Devriese et al. 2004, Severijns et al. 2013, Severijns et al. 2015, Draparnaud 1801, Marquet 1985","Southern Europe, Western Mediterranean",stowaway,C0,"Van Goethem 1987, Van Goethem 1988, Rinaldi 2003, Adam 1947, Marquet 1982"
R15554,"Trochoidea elegans (Gmelin, 1791)",,Well-defined species.,,,,,"Gastropoda Cuvier, 1806","Stylommatophora A. Schmidt, 1866","Hygromiidae Tryon, 1866","Trochoidea T. Brown, 1827",The species (5 fresh empty adult shells) was collected on 11 November 1976 in dunes of the natural reserve “De Westhoek” at De Panne.,Only known from the first record at De Panne. No records in Waarnemingen.be (accessed on 4 February 2019).,"Probably nortwestern Africa (Morocco, Algeria) and circum western Mediterranean coastal areas.","The species probably colonized our coastal dunes by natural dispersal from populations in northern France (Adam 1947a, b). Yet, these populations in northern France themselves may at least in part have been established by intentional human introductions. For example, in 1895 A. Giard deliberately introduced the species at Pointe aux Oies (Boulogne-sur-Mer, département Pas-de-Calais) using animals from the island of Tatihou (off Saint-Vaast-la-Hougue, département la Manche (Dutertre 1927; Cucherat 2006). As such it is not excluded that some populations in the Belgian coastal dunes (and elsewhere) are due to human introductions. For example, in 1866 J. Colbeau and E. Lanszweert intentionally released Algerian specimens of Theba pisana in dunes at Oostende to see whether they would acclimatize (Anonymous 1867; Anonymous 1869). Hence it is possible that the population discovered by Hostie (1935) at Mariakerke derived from these introduced specimens (Adam 1947b). In the same spirit J. Colbeau released Algerian Theba pisana in his garden at Ahérée, near Walcourt (Anonymous 1867). Yet, it seems that this latter population did not survive.",Fully invasive species; category E.,1976,1976,present,,"nortwestern Africa, circum western Mediterranean coastal areas.","disperal, relaese",E,"Adam 1947a, Adam 1947b, Dutertre 1927, Cucherat 2006, Hostie 1935, Adam 1947"
S66,"Xerosecta cespitum (Draparnaud, 1801)",,Well-defined species.,,,,,"Gastropoda Cuvier, 1807","Stylommatophora A. Schmidt, 1867","Geomitridae C.R. Boettger, 1909","Xerosecta Monterosato, 1892","This species was for the first time recorded in Belgium in Sart, near Spa, in 1941 (Adam 1943). Yet, the species was not found again at that locality (Marquet 1985). Much later, in 1980, a large living population of the species was recorded in the harbour of Antwerpen, where it survived at least until 1983 (Marquet 1985). Earlier one shell of this species was reported from Austruweel in the Antwerpen harbour (Adam 1937), yet, as this shell was lost, its identity cannot be verified.
Previous records of this species from the Belgian coastal dunes by Adam (1947, 1960) refer to Cernuella aginnica (Clerx & Gittenberger 1977; Marquet 1985; Van Goethem 1988).",It seems as if there are currently no surviving populations in Belgium.,"Western Mediterranean region, including southern France, Spain, northwestern Italy, Corsica, Sardinia, Balearic Islands, northwestern Africa (Tunisia, Algeria, Morocco).",Unclear,A single accidental introduction; category C0.,1941,1983,present,"Adam 1943, Marquet 1985, Adam 1937,Adam 1960, Clerx & Gittenberger 1977, Marquet 1985, Van Goethem 1988","southern France, Spain, northwestern Italy, Corsica, Sardinia, Balearic Islands, Tunisia, Algeria, Morocco",,C0,
S128,"Zebrina detrita (O.F. Müller, 1774)",,Well-defined species.,,,,,"Gastropoda Cuvier, 1808","Stylommatophora A. Schmidt, 1868","Enidae B.B. Woodward, 1903","Zebrina Held, 1838","In 1864 (or shortly before) several specimens of this species were collected alive in hedges near the “Casino” of Antwerpen, without further details (Anonymous 1864; Colbeau 1865).","Only known from the first record at the “Casino” of Antwerpen. The species was not found again at this site (Anonymous 1864). The record of this species from Waterloo near Brussels (Kickx 1830, De Malzine 1867) is probably erroneous (Anonymous [citing Colbeau] 1864; Colbeau 1865). The species is not mentioned in Waarnemingen.be (accessed on 4 February 2019).",Southern France.,Probably accidentally introduced by man.,Introduced species; category C0 to C3.,1864,1864,present,Colbeau 1865,Southern France.,stowaway,C0 - C3,
R16326,"Zonitoides arboreus (Say, 1817)",,Well-defined species.,,,,,"Gastropoda Cuvier, 1809","Stylommatophora A. Schmidt, 1869","Gastrodontidae Tryon, 1866","Zonitoides Lehmann, 1862","The species was for the first time well documented in Belgium in 2003 in the “Victoriakas” of the botanical garden of the University of Gent. Yet, the species was mentioned in the checklists by Van Goethem (1984a, b, 1987, 1988) as occurring in Belgian greenhouses without any further specification. Still earlier, Moens (1979, 1980) explicitly mentioned the occurrence of the species in Belgian greenhouse, yet without providing any further details.","Only reliably known from the record at the botanical garden of the University of Gent. No records in Waarnemingen.be (accessed on 4 February 2019). Probably more widespread in other botanical gardens and greenhouses (Moens 1979, 1980).","Southern, central and southeastern Europe up to central Turkey.",Unclear,A single accidental introduction; category C0.,2003,,present,"Van Goethem 1984a, Van Goethem 1987b, Van Goethem 1987, Van Goethem 1988","Southern Europe, central Europe, Southeastern Europe, central Turkey",,C0,
,,,,,,,,,,,,,,North America.,Probably introduced unintentionally with foreign plant materials.,The extent by which the species is established in Belgian greenhouses and nurseries needs to be investigated. Category B2.,,,,,Noth America,stowaway,B2,
